"","timestamp","dataoffollowup","office","occupation","age","civilstate","microfranchise","dateofstartofmicrofranchise","numberoffollowupsurvey","howgoodisthebusinessrunn","numberofunitssold","salesprice","profitfromsales","restockedproducts","howlongdidittaketosell","whodidyousellto","didyousellforcashorfor","whatdidyourclientssayabou","howmuchtimeofthedaydidy","wouldyouliketocontinuewi","planforimprovingsales","howdoyouratetheserviceo","additionalcomments","anon_id"
"935",2017-01-05 11:19:03,"05jan2017 10:30:00","Itá","Comerciante","37","Soltera","PMG","10/7/2016","0","Regular","Aproximadamente 15 unidades","Precios varios","Aproximadamente 300000","Sí","2 semanas","Amigos, Vecinos","Contado","0","2 horas","Si","Dedicarás más horas, Buscarás más clientes","Bien","La cliente comentó que le gusta la idea de negocio y que dentro de algunas semanas volverá  a vender",3601326
"936",2016-12-30 21:50:02,"30dec2016 21:51:00","Luque","Ventas","36","Casada","PMG","9/1/2016","2","Regular","30000 aprox.","Precio sugerido",".4","No","Más de 1 mes","Vecinos, Clientes ocasionales","Contado","Que el costo del producto es elevado, y el envase es muy pequeño, en el caso de los cosméticos","Horas libres","Si","Buscarás más clientes","Bien","Ningún comentario",3610503
"937",2016-10-24 11:23:12,"24oct2016 11:23:00","Luque","Ventas","36","Casada","PMG","9/1/2016","1","Regular","No hizo pedidos aun","-","-","No","-","-","Contado","Le dijeron que los productos son muy caros","-","Si","Buscarás más clientes","Bien","-",3610503
"938",2016-09-26 11:07:00,"26sep2016 11:03:00","San Lorenzo","0","35","Soltera","Doña Ana","6/13/2016","1","Bien","2 valde","cucurucho 2000  el kilo 20000","100 por cucurucho","No","aun no vendi todo","Amigos, Familia, Vecinos, Clientes ocasionales, Clientes de otras zonas","Contado","es rico","todo el dia","Si","Dedicarás más horas, Buscarás más clientes","Bien","esta por reponer",3611269
"939",2017-04-27 10:23:11,"27apr2017 10:00:00","Lambaré","ventas","28","Soltera","Kit de Limpieza","3/28/2017","1","Bien","40 litros","12000","120000","No","22 dias","Amigos, Familia, Vecinos, Int. de Comité","Contado","Que salio muy bien el producto","2 horas","Si","Buscarás más clientes","Bien","-",3617869
"940",2016-12-26 17:01:15,"26dec2016 04:53:00","Lambaré","Vendedora","36","Soltera","Only","9/18/2016","2","Bien","0","0","0","No","0","Amigos","Contado","-","Pocas horas","Si","Dedicarás más horas","Super Bien","-",3622972
"941",2016-10-27 14:17:49,"27oct2016 02:10:59","Lambaré","Vendedora","36","Soltera","Only","9/27/2016","1","Bien","7","45000/85000","600000","Sí","-","Amigos, Familia, Vecinos","Contado","-","20 dias","Si","Dedicarás más horas","Bien","-",3622972
"942",2017-04-27 16:56:25,"27apr2017 09:00:00","Mariano Roque Alonso","Costurera/Ventas","38","Soltera","PMG","3/29/2017","1","Bien","Su primer pedido estaría llegando en la siguiente semana","De 40000 a 80000 guaranies",".","No","Su primer pedido estaría llegando en la siguiente semana","Amigos, Familia","Contado",".","Una hora en promedio","Si","Buscarás más clientes","Super Bien",".",3625510
"943",2016-12-26 16:57:52,"22dec2016 10:59:59","Chaco","Ventas","35 años","Soltera","Tuka Helados","11/28/2016","1","Bien","2 fardos","500Gs","85000","Sí","En 8 dias","Vecinos","Contado","Les gusta el producto","Todo el dia","Si","Buscarás más clientes","Bien","Nos quedamos sin proveedor y ya tengo muchos clientes",3625660
"944",2017-02-28 11:44:56,"08feb2017 08:30:00","Villa Elisa","Vendedora","35","Concubinada","Nutrihuevos","1/26/2017","1","Bien","30 planchas en 1 semana","2500mas","75000","Sí","1 semana","Amigos, Vecinos","Contado",".","Durante el dia","Si","Buscarás más clientes","Bien","La sra tiene una despensa entonces compra para vender por unidad y por plancha por su zona",3631129
"945",2017-05-30 14:06:41,"30may2017 08:30:00","Villa Elisa","Empleada","37","Casada","Nutrihuevos","10/14/2016","4","Bien","10 planchas por semana","por unidad a 1000","100000","Sí","1 semana","Vecinos, Clientes ocasionales","Contado","Ningun comentario negativo","Todo el dia","Si","Dedicarás más horas","Bien","La sra tiene una despensa, por lo que vende mas por unidad, dejo un tiempo por problemas personales pero ya esta retomando nuevamente",3631129
"946",2016-11-22 14:14:22,"22nov2016 10:09:59","Villa Elisa","Empleada Privada","36","Casada","Doña Ana","10/14/2016","1","Bien","10 baldes","1000 el cucurucho","300000","Sí","4 dias","Amigos, Familia, Vecinos, Clientes ocasionales","Contado","Es un helado muy rico","Durante el dia","Si","Reponer con mas sabores","Bien","La sra tiene una despensa que su hija atiende y estan cerca de una canchita por eso le va super bien la venta de los helados ya hizo varias veces la reposcion",3631129
"947",2017-05-30 14:04:00,"30may2017 08:30:00","Villa Elisa","Empleada","37","Casada","Doña Ana","10/14/2016","4","Super Bien","3 baldes por semana","a parti de 2000","300000","Sí","1 semana","Vecinos, Clientes ocasionales","Contado","nada negativo","Todo el dia","Si","Dedicarás más horas","Bien","Sigue vendiendo y ella misma se va a retirar por que el sr no le lleva en el dia acordado, aparte de eso la sra varias veces le hizo pedido de masas dulces tambien y no le llevo",3631129
"948",2017-01-26 11:18:47,"25jan2017 16:00:00","Villa Elisa","Empleada y Vendedora","37","Soltera","Doña Ana","10/14/2016","2","Bien","15 baldes","A partir de 1.000","500000","Sí","2 fines de semana","Amigos, Familia, Vecinos","Contado","Tiene ricos sabores","Fines de semana","Si","Dedicarás más horas","Bien","La sra tiene una despensa, lo que le viene super bien la venta de los helados, su hija es la que se encarga y venden mas los fines de semana por que tiene una placita cerca, esta super contenta con los helados de doña ana",3631129
"949",2017-07-27 16:18:47,"27jun2017 09:00:00","Villa Elisa","Vendedora","35","Soltera","Narella","2/28/2017","2","Bien","50 aprox","Precio Catalogo","400000","Sí","15 dias","Amigos, Familia","Contado","Tienen problemas con los talles","Durante el dia","Si","Dedicarás más horas","Bien","Tiene inconvenientes con sus clientes por los talles de las prendas que varian mucho, tambien en los cortes aveces tiene imperfecciones",3631154
"950",2017-05-30 10:01:46,"29may2017 10:14:59","Villa Elisa","Vendedora","35","Casada","Narella","2/28/2017","2","Bien","60 aprox","Precio Sugerido","400000","Sí","2 semanas","Amigos, Familia, Vecinos","Contado","Tiene precios bajos","Durante el dia","Si","Dedicarás más horas, Buscarás más clientes","Bien","Cuando es la campaña de fin de mes suele haber mas pedidos, y cuando hay catalogo nuevo",3631154
"951",2017-03-14 11:56:22,"14mar2017 11:57:00","Luque","Ventas","38","Casada","Doña Ana","11/5/2016","2","Regular","Solo kit inicial","Precio sugerido","No tuvo ganancias, ya que pago por sus mercaderías del kit inicial","No","15 días","Vecinos","Contado","Les gusta la calidad del producto","Medio día","No","-","Bien","El costo del producto y no le deja muchas ganancias. Aquiere de otro proveedor",3639100
"952",2016-12-30 07:34:20,"30dec2016 07:31:00","Luque","Ventas","38","Casada","Doña Ana","11/5/2016","1","Regular","El kit inicial","Precio suerido","No dejó muchas ganancias","No","15 días","Vecinos","Contado","Les gusta el producto","Medio día","No","Buscarás más clientes","Bien","El producto sale mas caro, por lo que esta viendo otras opciones del producto.",3639100
"953",2016-09-22 11:28:46,"22sep2016 11:18:00","Lambaré","Comerciante","40","Soltera","Narella","8/22/2016","1","Super Bien","10","20000/45000/65000","200000","Sí","15 dias","Vecinos","Contado","Les gusto bastante","2 Horas aproximadamente","Si","Dedicarás más horas","Super Bien","-",3642179
"954",2016-11-22 12:38:18,"22nov2016 12:33:00","Lambaré","Comerciante","40","Soltera","Narella","9/15/2016","2","Bien","10","25000/45000/90000/20000","100000","Sí","10 dias","Amigos, Vecinos","Contado","-","-","Si","Dedicarás más horas","Bien","-",3642179
"955",2017-04-28 12:14:19,"28apr2017 12:07:00","Lambaré","Ventas","40","Soltera","Narella","8/22/2016","4","Regular","4","25000/45000/75000/90000","60000","Sí","-","Amigos","Contado","-","-","No","Dedicarás más horas","Bien","-",3642179
"956",2017-01-26 16:05:15,"26jan2017 16:01:00","Lambaré","Comerciante","40","Soltera","Narella","8/22/2016","3","Bien","10","20.000-45.000-60.000-75.000-69.000-110.000","220000","Sí","15 dias","Amigos, Familia, Vecinos","Contado","-","6 horas diarias","Si","Buscarás más clientes","Bien","-",3642179
"957",2016-12-30 07:46:12,"30dec2016 07:40:00","Luque","Ventas","36","Soltera","Doña Ana","11/19/2016","1","Bien","Kit inicial","1000 el sabor","No hubo muchas ganancias","No","3 semanas","Amigos, Vecinos","Contado","Les gusto el producto","Medio día","No","-","Bien","Esta viendo otra marca local, ya que le deja mas ganancias",3648524
"958",2017-03-31 09:57:54,"31mar2017 09:49:59","Luque","Ventas","36","Soltera","Doña Ana","11/19/2016","2","Regular","El kit inicial","Precio sugerido","20% aproximadamente","No","1 mes","Vecinos","Contado","Les gustó la calidad del producto","Horas libres","No","-","Bien","Manifiesta que le sale más barato de otra marca.",3648524
"959",2016-12-30 10:10:43,"30dec2016 10:00:00","Carapeguá","Fisioterapeuta","31","Casada","PMG","6/17/2015","3","Regular","20","650000","200000","Sí","Un mes","Amigos, Familia, Vecinos","Contado","salen muy bien","Media hora","Si","Dedicarás más horas, Buscarás más clientes","Bien","Ninguna",3651406
"960",2016-07-26 17:51:03,"26jul2016 16:05:00","Luque","Venta de productos de limpieza","38","Soltera","PMG","6/29/2016","1","Excelente","Por valor de 1300000","Precio sugerido en el catalogo","520000","Sí","15 dias","Amigos, Vecinos","Contado","Les gusta el producto","Horas libres","Si","Dedicarás más horas, Buscarás más clientes","Excelente","Ningún comentario",3654120
"961",2016-09-30 11:03:39,"30sep2016 09:20:00","Asunción","Empleada Privada","22","Soltera","Nutrihuevos","7/8/2016","1","Bien","100","3000 mas","250000","Sí","Durante el dia","Amigos","Contado","Super bien le sale el producto","POr la tarde","Si","Dedicarás más horas","Bien","Ella trabaja en una empresa por lo que un familiar se encarga de salir a vender los huevos",3656427
"962",2017-01-30 15:03:09,"30jan2017 15:00:00","Carapeguá","Empleada","31","Concubinada","Narella","9/15/2016","2","Bien","25","2000000","500000","Sí","un mes","Amigos, Familia, Vecinos","Contado","Salen muy bien las prendas","Una hora","Si","Dedicarás más horas, Buscarás más clientes","Bien","Ninguna",3660132
"963",2016-11-30 07:45:33,"30nov2016 07:59:59","Carapeguá","Ventas","31","Concubinada","Narella","10/15/2016","1","Bien","30","1100000","450000","Sí","15 días","Amigos, Familia, Vecinos","Contado","Salen muy bien","Una Hora","Si","Dedicarás más horas, Buscarás más clientes","Bien","Ninguno",3660132
"964",2017-04-28 11:26:47,"28apr2017 11:19:59","Carapeguá","Ventas","24","Soltera","Narella","1/31/2017","1","Bien","8","328000","80000","Sí","1 mes","Amigos","Contado","Sale muy bien","1 horA","Si","Buscarás más clientes","Bien","La señora tuvo dificultad para pagar adelantado por las prendas...",3661276
"965",2017-01-04 11:03:56,"04jan2017 10:40:59","Ybycui","ventas","35","Soltera","Unilever","12/2/2016","1","Bien","ya vendi todo","en el precio sugerido","entre los 100000 a 150000 aproximadamente","Sí","en 15 dias mas o menos","Amigos, Vecinos","Contado","les gusto","3 veces por semana","Si","Buscarás más clientes","Bien","ningun inconveniente",3662739
"966",2017-03-23 13:03:05,"23sep2017 12:52:00","Ybycui","ventas","36","Soltera","Unilever","12/2/2016","2","Bien","vendi todo la primera vez,ahora ya hice mi primera reposicion y me va muy bien","precio sugerido","la primera vez 200000 y ahora le calculo que me dejaria una ganancia de 150000 mas o menos","Sí","en 22 dias aproximadamente","Amigos, Familia, Vecinos, Clientes ocasionales","Contado","que sale muy bien,les gusta a mis clientes que tenga mas variedad de productos","todos los dias","Si","Buscarás más clientes","Bien","me gusta mucho la microfranquicia",3662739
"967",2016-12-30 09:01:49,"30dec2016 08:57:00","Luque","Peluquera","42","Soltera","Narella","11/30/2016","1","Bien","Por valor de 1000000","Precio del catálogo","25% aprox.","Sí","15 días","Clientes propios","Contado","Les gusta la calidad del producto","Medio día","Si","Buscarás más clientes","Super Bien","Ningún comentario",3674163
"968",2017-04-29 21:45:43,"29apr2017 21:40:59","Luque","Peluquería","42","Soltera","Narella","11/30/2016","2","Bien","Por valor de 300000 aprox.","Precio del catálogo","25 % aproximadamente","Sí","15 días","Vecinos","Contado","Les gusta la calidad del producto","Horas libres","Si","Buscarás más clientes","Bien","Ningún comentario",3674163
"969",2017-07-28 15:18:54,"28jul2017 15:24:59","Villa Elisa","Vendedora","36","Casada","Nutrihuevos","12/13/2016",".","Deserto",".",".",".","Sí",".","Vecinos","Contado",".",".","No","Desercion","Bien","La sra dejo de vender por problemas de pago de su comite, en este momento esta con gestiones judiciales con la fundacion paraguaya.",3691329
"970",2017-05-30 11:57:43,"29may2017 13:59:59","Villa Elisa","Vendedora","35","Soltera","Nutrihuevos","1/13/2016","3","Deserto","0","0","0","Sí","0","Amigos","Contado","0","0","No","Deserto","Bien","Deserto por problemas de pago del comite",3691329
"971",2017-01-24 11:04:42,"23dec2017 08:39:59","Villa Elisa","Vendedora","35","Casada","Nutrihuevos","12/13/2016","1","Bien","50 planchas","15000","140000","Sí","1 semana","Amigos, Vecinos","Contado","Conocen la marca por eso compran sin problemas","Durante el dia","Si","Dedicarás más horas","Bien","La sra levanta pedidos de los huevos, y compra para la entrega inmediata por el calor ya que asi no puede tener mucho tiempo los huevos y suele comprar en pocas cantidades por eso",3691329
"972",2017-03-31 11:21:05,"30mar2017 11:30:00","Villa Elisa","Vendedora","35","Soltera","Nutrihuevos","12/13/2016","2","Bien","30 semanal","3000 mas","10000","Sí","1 semana","Vecinos, Clientes ocasionales","Contado","Se quejan que el precio es alto ahora","Todo el dia","Si","Dedicarás más horas","Bien","La sra tenia otro trabajo, perdio entonces ahora se dedica a la venta de huevos ya que ese es su principal fuente de ingreso, se va a retirar del abasto solo que ahora que el huevo esta caro le cuesta invertir por que solo en cantidad puede tener buena ganancia",3691329
"973",2017-04-28 15:10:33,"28apr2017 15:01:00","Lambaré","Ventas","38","Soltera","Doña Ana","2/16/2017","1","Bien","20 kilos","30000","180000","Sí","22 dias","Amigos, Familia, Vecinos","Contado","-","-","Si","Dedicarás más horas","Bien","-",3694516
"974",2016-10-24 11:36:29,"24oct2016 11:36:00","Luque","Ventas","34","Soltera","Narella","9/2/2016","1","Bien","Por valor de 372000","Precio del catálogo","28% de cada producto","Sí","15 días","Amigos, Vecinos","Contado","Les gusta el producto","Horas libres","Si","Buscarás más clientes","Bien","Ningún comentario",3702510
"975",2017-03-30 12:05:57,"30mar2017 12:00:00","Luque","Ventas","34","Soltera","Narella","9/2/2016","2","Regular","La ultima vez por 300000 aprox.","Precio del catálogo","El 25 % aproximadamente","Sí","1 mes","Vecinos","Contado","Les gustó la calidad del producto","Horas libres","No","-","Bien","Manifiesta que no tiene capital para volver a vender, por el momento no quiere vender más.",3702510
"976",2016-10-30 19:43:33,"26oct2016 10:00:00","Chaco","Empleada domestica","25","Concubinada","Kit de Limpieza","9/22/2016","1","Excelente","4 kit","5.000 el litro","540000","Sí","en un mes","Vecinos","Contado","les gusta el producto","3 horas","Si","Buscarás más clientes","Excelente","Aumente mis ingresos con la venta de las microfranquicias",3709300
"977",2017-03-22 13:24:05,"22mar2017 10:00:00","Chaco","Ventas","25 años","Soltera","Sael Joyas","1/12/2017","2","Bien","Un kit y dos reposiciones","Al precio establecido por Sael Joyas","Estoy ganando un promedio de 400.000 mensual","Sí","En 22 dias","Clientes de otras zonas","Contado","Les gusta la calidad de las joyas","3 horas","Si","Buscarás más clientes","Bien","Con la venta de microfranquicias aumente mis ingresos",3709300
"978",2017-04-24 14:51:00,"24apr2017 10:59:59","Chaco","Ventas","25 años","Concubinada","Kit de Limpieza","9/22/2016","2","Bien","Uno a dos kits por semana","5.000 el litro","135.000 por cada kit","Sí","En una semana","Vecinos","Contado","Les gusta la calidad y el precio","Todo el día ( en mi domicilio)","Si","Buscarás más clientes","Bien","Con la venta de microfranquicias tengo un ingreso semanal",3709300
"979",2017-02-17 15:45:54,"16feb2017 10:00:00","Chaco","Empleada Privada","25","Soltera","Sael Joyas","1/12/2017","1","Bien","15 unidades","Al precio establecido por Sael Joyas","300000","Sí","En 22 dias","Vecinos","Contado","Les gusta la calidad y el precio de los productos.","3 horas","Si","Buscarás más clientes","Bien","Con la venta de joyas aumente mis ingresos",3709300
"980",2016-10-30 19:40:33,"26oct2016 10:00:00","Chaco","Empleada domestica","25","Concubinada","Doña Ana","9/22/2016","1","Excelente","10 baldes","Al pprecio establecido","300000","Sí","en un mes","Vecinos","Contado","Les gusta el producto","Todo el dia","Si","Buscarás más clientes","Excelente","Aumente mis ingresos con la venta de microfranquicias",3709300
"981",2017-05-26 17:09:00,"26may2017 17:06:00","Luque","Empleada en empresa privada","33","Soltera","Nutrihuevos","3/31/2017","3","Bien","40 planchas","19000, 20000","3000 por plancha","Sí","1 mes","Vecinos","Contado","Les gusta la calidad del producto","Medio día","Si","Buscarás más clientes","Bien","Ningún comentario",3711309
"982",2017-04-29 20:51:59,"29apr2017 20:45:59","Luque","Empleada en empresa privada","33","Soltera","Nutrihuevos","3/31/2017","1","Bien","Más de 50 planchas","19000","2000 y 3000 por cada plancha","Sí","1 semana","Clientes de otras zonas","Contado","Les gusta la calidad del producto","Medio día","Si","Buscarás más clientes","Bien","La microfranquiciada manifiesta que está reponiendo 10 planchas semanales de manera contínua.",3711309
"983",2017-04-24 16:08:58,"24apr2017 10:59:59","Luque","Trabaja en un supermercado a medio tiempo","33","Soltera","Nutrihuevos","3/31/2017","1","Bien","40 planchas","Precio sugerido","1500 por plancha","No","2 semanas","Clientes ocasionales, Clientes de otras zonas, Al supermercado en el cual trabaja","Contado","Les gusto la calidad y el tamaño del producto","Medio tiempo durante la tarde","Si","Buscarás más clientes","Bien","Ningún comentario",3711309
"984",2017-03-31 11:27:40,"30mar2017 11:44:59","Villa Elisa","Vendedor","34","Soltera","Nutrihuevos","1/11/2017","1","Bien","30 semanal","3000 mas","100000","Sí","1 semana","Amigos, Vecinos, Clientes ocasionales","Contado","La marca es conocida por eso no protestan","Durante el dia","Si","Buscarás más clientes","Bien","Le va super bien,repone bastante ahora ya hizo el reclamo de sus premios por que ya paso el limite de docenas, el sale a recorrer en varias en su vehiculo.",3714944
"985",2017-04-27 11:03:03,"27apr2017 09:20:00","Caacupe","Empleada Domestica","36","Concubinada","PMG","3/8/2017","1","Bien","0","0","0","No","0","Amigos","Contado","0","0","Si","Dedicarás más horas, Buscarás más clientes","Super Bien","La señora comenta que no vendio aun por falta de tiempo",3719063
"986",2016-08-30 17:52:13,"30aug2016 16:59:59","Luque","Ventas","39","Soltera","PMG","7/27/2016","1","Regular","No esta pudiendo realizar sus ventas","-","-","No","-","Clientes ocasionales","Contado","-","-","Si","Buscarás más clientes","Bien","-",3720707
"987",2016-07-29 14:11:33,"29jul2016 14:10:00","Luque","Ventas","39","Soltera","Tuka Helados","2/25/2016","1","Bien","-","500","250","Sí","2 semanas","Vecinos","Contado","Les gusta el producto","Medio día","Si","Buscarás más clientes","Bien","Ningún comentario",3720707
"988",2016-08-30 10:16:49,"30aug2016 10:13:00","San Lorenzo","comerciante","22","Soltera","PMG","8/30/2016","1","Bien","3","precio sugerido","80000","Sí","una semana","Amigos, Familia, Vecinos, Clientes ocasionales, Clientes de otras zonas","Cuotas","Les gusta mucho","4 horas","Si","Dedicarás más horas, Buscarás más clientes","Bien","Está realizando su reposición",3722408
"989",2017-08-31 12:44:50,"30aug2017 14:50:00","Itá","Comerciante","31","Soltera","PMG","1/24/2017","1","Regular","Aproximadamente 10 unidades","Precios varios","Aproximadamente 300000","Sí","en 1 semana","Vecinos","Contado","0","2 horas","Si","Dedicarás más horas, Buscarás más clientes","Bien","0",3726450
"990",2016-11-30 19:23:44,"30nov2016 19:00:00","Carapeguá","Comerciante","39","Casada","PMG","8/31/2016","2","Bien","0","0","0","No","-","--","Contado","--","--","Si","--","Bien","La señora no hizo pedidos de pmg, llevo también catálogo de narella, presento su pedido y tampoco retiró",3732552
"991",2016-09-28 08:04:44,"28sep2016 07:59:59","Carapeguá","Vendedora","39","Casada","PMG","8/31/2016","1","Regular","6 pedidos","-","-","No","un  mes","Amigos","Contado","-","una hora","Si","Buscarás más clientes","Bien","La señora quiere juntar más pedidos para enviar, no ha tenido tiempo para salir a ofrecer debido a que tiene que atender su negocio...",3732552
"992",2017-01-25 15:35:06,"25jan2017 15:24:59","Paraguarí","Nutricionista","26","Soltera","Narella","11/20/2016","2","Bien","7","1.3","300000","Sí","Pedido en la Quincena","Amigos, Familia, Vecinos, Clientes ocasionales","Contado","Son buenas prendas","Por las tardes","Si","Dedicarás más horas, Buscarás más clientes","Bien","Ninguna",3732980
"993",2016-12-30 11:59:32,"30dec2016 11:44:59","Paraguarí","Nutricionista","26","Soltera","Narella","11/17/2016","1","Bien","12","100000","500000","Sí","Pedido de una Quincena","Amigos, Familia, Vecinos, Clientes ocasionales","Contado","Son buenisimas prendas","Por las tardes","Si","Dedicarás más horas, Buscarás más clientes","Bien","Tardan en entregar los pedidos",3732980
"994",2017-05-16 13:34:34,"16may2017 13:00:00","San Lorenzo","Vendedora","35","Soltera","Only","4/20/2017","1","Bien","14","jeans por 95.000 y remera por 60mil","505000","Sí","una semana","Clientes ocasionales","Contado","salen muy bien las prendas","todo el día","Si","Buscarás más clientes","Bien","Le gusto el kit inicial, pero sugiere que haya descuentos similares al kit inicial siempre, que no varíe tanto el precio.",3734595
"995",2017-08-31 12:06:16,"30aug2017 11:10:00","Itá","Comerciante","36","Soltera","PMG","1/31/2017","1","Bien","Aproximadamente 10 unidades","Precios varios","Aproximadamente 390000","Sí","En 2  semanas","Vecinos","Contado","0","1 hora","Si","Dedicarás más horas, Buscarás más clientes","Bien","0",3735505
"996",2017-03-31 09:08:12,"31mar2017 08:10:00","Itá","Comerciante","22","Soltera","PMG","2/6/2017","0","Bien","Aproximadamente 10 unidades","Precios varios","Aproximadamente 290000","Sí","2 semanas","Vecinos","Contado","0","1 hora","Si","Buscarás más clientes","Bien","La cliente comento que le gusta el negocio y que cuando vuelva  a tener capital venderà otra vez",3735505
"997",2016-10-31 17:07:03,"31oct2016 04:59:59","Luque","Ventas","35","Casada","PMG","9/1/2016","1","Bien","Esta levantando pedido","Precio sugerido","_","No","-","Vecinos","Contado","-","-","Si","Dedicarás más horas, Buscarás más clientes","Bien","Ningún comentario",3739560
"998",2016-08-31 09:36:33,"31aug2016 09:35:00","Luque","Ventas","35","Casada","Only","2/14/2016","1","Bien","El kit inicial","160000, 55000","1085000","No","1 mes","Vecinos","Contado","Les gustó el producto","Horas libres","Si","Buscarás más clientes","Bien","Ningún comentario",3739560
"999",2017-06-30 17:15:45,"30jun2017 17:06:00","Luque","Ventas","-","Casada","PMG","9/1/2016","2","Regular","-","Precio sugerido","25 % aproximadamente","No","-","Vecinos","Contado","Les gusto la calidad del producto","-","Si","Buscarás más clientes","Bien","Ningún comentario",3739560
"1000",2016-10-19 15:10:12,"19oct2016 14:19:59","Villa Elisa","Vendedora","35","Soltera","PMG","9/20/2016","1","Bien","15","precio sugerido","400000","Sí","1 semana","Amigos, Familia, Vecinos","Contado","Tiene lindas fragancias","Durante el dia","Si","Dedicarás más horas","Bien","La cliente vendia pmg anteriormente a travez de una amiga, prestaba su muestrario luego se entero del convenio con la fundacion y solicito su propio lit y ser independiente",3740840
"1001",2017-02-28 15:33:57,"09feb2017 10:59:59","Villa Elisa","Vendedora","35","Soltera","PMG","9/16/2016","2","Bien","10 aprox","Precio Sugerido","450000","Sí","2 semanas","Amigos, Familia","Contado","Muchos no conocen y estan probando","Durante el dia","Si","Dedicarás más horas","Bien","No muchos conocen pero les gusta la fragancia entonces por es se animan a probar los perfumes",3740840
"1002",2016-11-16 11:19:57,"16nov2016 11:15:00","Asunción","ventas de ropas","45","Soltera","Narella","2/15/2016","1","Bien","35","precio de catalogos",".25","Sí","cada 15 dias","Amigos, Familia, Vecinos, Int. de Comité","Contado","buena calidad","todos los dias","Si","Dedicarás más horas","Bien","ningun comentario",3751967
"1003",2016-09-22 13:32:14,"22sep2016 13:09:59","Chaco","Empleada privada","37 años","Concubinada","Doña Ana","8/10/2016","1","Excelente","2 kit","Al precio establecido","400000","Sí","En un mes","Amigos, Familia, Vecinos","Contado","Les gusta la calidad de los productos","Todo el dia (en la casa)","Si","Buscarás más clientes","Excelente","Con la venta de helados aumente mis ingresos",3757055
